Priority,Name,Priority Level,Status,Target Completion Date,Year
No,Wake up early,Medium,Not started,"January 1, 2026",2026
No,Travel to a new place,Medium,Not started,,
Yes,Do courses on Finance,High,Not started,"November 30, 2025",2025
No,Go to the highest mountain,Low,Not started,,
No,Get back to swimming,Low,Not started,,
Yes,Sustain a healthy lifestyle,High,In progress,"January 31, 2026",2026
Yes,Have a new source of income,Medium,Not started,,
Yes,"Learn Spanish ",Medium,Not started,,
No,Work out 5x week,Medium,Not started,"December 1, 2025",2025